{
  "address": "0x8De9b71679cF2A4D4c5569a13AD8D69A475c8775",
  "abi": [
    {
      "inputs": [
        {
          "internalType": "address",
          "name": "timelock_",
          "type": "address"
        },
        {
          "internalType": "address",
          "name": "comp_",
          "type": "address"
        },
        {
          "internalType": "address",
          "name": "admin_",
          "type": "address"
        },
        {
          "internalType": "address",
          "name": "implementation_",
          "type": "address"
        },
        {
          "internalType": "uint256",
          "name": "votingPeriod_",
          "type": "uint256"
        },
        {
          "internalType": "uint256",
          "name": "votingDelay_",
          "type": "uint256"
        },
        {
          "internalType": "uint256",
          "name": "proposalThreshold_",
          "type": "uint256"
        }
      ],
      "stateMutability": "nonpayable",
      "type": "constructor"
    },
    {
      "anonymous": false,
      "inputs": [
        {
          "indexed": false,
          "internalType": "address",
          "name": "oldAdmin",
          "type": "address"
        },
        {
          "indexed": false,
          "internalType": "address",
          "name": "newAdmin",
          "type": "address"
        }
      ],
      "name": "NewAdmin",
      "type": "event"
    },
    {
      "anonymous": false,
      "inputs": [
        {
          "indexed": false,
          "internalType": "address",
          "name": "oldImplementation",
          "type": "address"
        },
        {
          "indexed": false,
          "internalType": "address",
          "name": "newImplementation",
          "type": "address"
        }
      ],
      "name": "NewImplementation",
      "type": "event"
    },
    {
      "anonymous": false,
      "inputs": [
        {
          "indexed": false,
          "internalType": "address",
          "name": "oldPendingAdmin",
          "type": "address"
        },
        {
          "indexed": false,
          "internalType": "address",
          "name": "newPendingAdmin",
          "type": "address"
        }
      ],
      "name": "NewPendingAdmin",
      "type": "event"
    },
    {
      "anonymous": false,
      "inputs": [
        {
          "indexed": false,
          "internalType": "uint256",
          "name": "id",
          "type": "uint256"
        }
      ],
      "name": "ProposalCanceled",
      "type": "event"
    },
    {
      "anonymous": false,
      "inputs": [
        {
          "indexed": false,
          "internalType": "uint256",
          "name": "id",
          "type": "uint256"
        },
        {
          "indexed": false,
          "internalType": "address",
          "name": "proposer",
          "type": "address"
        },
        {
          "indexed": false,
          "internalType": "address[]",
          "name": "targets",
          "type": "address[]"
        },
        {
          "indexed": false,
          "internalType": "uint256[]",
          "name": "values",
          "type": "uint256[]"
        },
        {
          "indexed": false,
          "internalType": "string[]",
          "name": "signatures",
          "type": "string[]"
        },
        {
          "indexed": false,
          "internalType": "bytes[]",
          "name": "calldatas",
          "type": "bytes[]"
        },
        {
          "indexed": false,
          "internalType": "uint256",
          "name": "startBlock",
          "type": "uint256"
        },
        {
          "indexed": false,
          "internalType": "uint256",
          "name": "endBlock",
          "type": "uint256"
        },
        {
          "indexed": false,
          "internalType": "string",
          "name": "description",
          "type": "string"
        }
      ],
      "name": "ProposalCreated",
      "type": "event"
    },
    {
      "anonymous": false,
      "inputs": [
        {
          "indexed": false,
          "internalType": "uint256",
          "name": "id",
          "type": "uint256"
        }
      ],
      "name": "ProposalExecuted",
      "type": "event"
    },
    {
      "anonymous": false,
      "inputs": [
        {
          "indexed": false,
          "internalType": "uint256",
          "name": "id",
          "type": "uint256"
        },
        {
          "indexed": false,
          "internalType": "uint256",
          "name": "eta",
          "type": "uint256"
        }
      ],
      "name": "ProposalQueued",
      "type": "event"
    },
    {
      "anonymous": false,
      "inputs": [
        {
          "indexed": false,
          "internalType": "uint256",
          "name": "oldProposalThreshold",
          "type": "uint256"
        },
        {
          "indexed": false,
          "internalType": "uint256",
          "name": "newProposalThreshold",
          "type": "uint256"
        }
      ],
      "name": "ProposalThresholdSet",
      "type": "event"
    },
    {
      "anonymous": false,
      "inputs": [
        {
          "indexed": true,
          "internalType": "address",
          "name": "voter",
          "type": "address"
        },
        {
          "indexed": false,
          "internalType": "uint256",
          "name": "proposalId",
          "type": "uint256"
        },
        {
          "indexed": false,
          "internalType": "uint8",
          "name": "support",
          "type": "uint8"
        },
        {
          "indexed": false,
          "internalType": "uint256",
          "name": "votes",
          "type": "uint256"
        },
        {
          "indexed": false,
          "internalType": "string",
          "name": "reason",
          "type": "string"
        }
      ],
      "name": "VoteCast",
      "type": "event"
    },
    {
      "anonymous": false,
      "inputs": [
        {
          "indexed": false,
          "internalType": "uint256",
          "name": "oldVotingDelay",
          "type": "uint256"
        },
        {
          "indexed": false,
          "internalType": "uint256",
          "name": "newVotingDelay",
          "type": "uint256"
        }
      ],
      "name": "VotingDelaySet",
      "type": "event"
    },
    {
      "anonymous": false,
      "inputs": [
        {
          "indexed": false,
          "internalType": "uint256",
          "name": "oldVotingPeriod",
          "type": "uint256"
        },
        {
          "indexed": false,
          "internalType": "uint256",
          "name": "newVotingPeriod",
          "type": "uint256"
        }
      ],
      "name": "VotingPeriodSet",
      "type": "event"
    },
    {
      "anonymous": false,
      "inputs": [
        {
          "indexed": false,
          "internalType": "address",
          "name": "account",
          "type": "address"
        },
        {
          "indexed": false,
          "internalType": "uint256",
          "name": "expiration",
          "type": "uint256"
        }
      ],
      "name": "WhitelistAccountExpirationSet",
      "type": "event"
    },
    {
      "anonymous": false,
      "inputs": [
        {
          "indexed": false,
          "internalType": "address",
          "name": "oldGuardian",
          "type": "address"
        },
        {
          "indexed": false,
          "internalType": "address",
          "name": "newGuardian",
          "type": "address"
        }
      ],
      "name": "WhitelistGuardianSet",
      "type": "event"
    },
    {
      "stateMutability": "payable",
      "type": "fallback"
    },
    {
      "inputs": [
        {
          "internalType": "address",
          "name": "implementation_",
          "type": "address"
        }
      ],
      "name": "_setImplementation",
      "outputs": [],
      "stateMutability": "nonpayable",
      "type": "function"
    },
    {
      "inputs": [],
      "name": "admin",
      "outputs": [
        {
          "internalType": "address",
          "name": "",
          "type": "address"
        }
      ],
      "stateMutability": "view",
      "type": "function"
    },
    {
      "inputs": [],
      "name": "implementation",
      "outputs": [
        {
          "internalType": "address",
          "name": "",
          "type": "address"
        }
      ],
      "stateMutability": "view",
      "type": "function"
    },
    {
      "inputs": [],
      "name": "pendingAdmin",
      "outputs": [
        {
          "internalType": "address",
          "name": "",
          "type": "address"
        }
      ],
      "stateMutability": "view",
      "type": "function"
    }
  ],
  "transactionHash": "0x74e3a9a1084acf40362b5d5ca82f4abb6288704b35ed0b7b4003552b956cc5e1",
  "receipt": {
    "to": null,
    "from": "0xc62661BAe6E8346725305318476521E87977E371",
    "contractAddress": "0x8De9b71679cF2A4D4c5569a13AD8D69A475c8775",
    "transactionIndex": 0,
    "gasUsed": "410180",
    "logsBloom": "0x00000000000000000000000000000000000000000000000000000000000000000000000000000000000000000000000000000000000000000000000000000000000000000000080000000000000000000000000000000000000000000000000000000000000000000000000001000000000000000000000000000000000000000400000000000000000000000000000000000000000004000000000000000000000000000080000000000000000000000000000000000000000000000000000000000000000000000000000000000000000200000000000000000000000000000000000000000000000000000000000000000000000000000000000000000000",
    "blockHash": "0x51a0bc663ce0084dc0d34876f937871d19497fff2472e76c2b53f812a1777fa7",
    "transactionHash": "0x74e3a9a1084acf40362b5d5ca82f4abb6288704b35ed0b7b4003552b956cc5e1",
    "logs": [
      {
        "transactionIndex": 0,
        "blockNumber": 12748763,
        "transactionHash": "0x74e3a9a1084acf40362b5d5ca82f4abb6288704b35ed0b7b4003552b956cc5e1",
        "address": "0x8De9b71679cF2A4D4c5569a13AD8D69A475c8775",
        "topics": [
          "0xd604de94d45953f9138079ec1b82d533cb2160c906d1076d1f7ed54befbca97a"
        ],
        "data": "0x0000000000000000000000000000000000000000000000000000000000000000000000000000000000000000446c77d6f04c21a83d6b6a4248ab238c373c68ea",
        "logIndex": 0,
        "blockHash": "0x51a0bc663ce0084dc0d34876f937871d19497fff2472e76c2b53f812a1777fa7"
      }
    ],
    "blockNumber": 12748763,
    "cumulativeGasUsed": "410180",
    "status": 1,
    "byzantium": true
  },
  "args": [
    "0x14C9503590a9Bf97fE71B8D2b1b23d531CE9d2FF",
    "0xDEa30a448ae088330B313deE64c13b5a7dE1516a",
    "0xc62661BAe6E8346725305318476521E87977E371",
    "0x446C77D6f04C21A83D6b6a4248AB238C373C68ea",
    40320,
    20160,
    {
      "_hex": "0x0a968163f0a57b400000"
    }
  ],
  "numDeployments": 1,
  "solcInputHash": "eecd7762ef49b96a47f0ae6feefff385",
  "metadata": "{\"compiler\":{\"version\":\"0.8.10+commit.fc410830\"},\"language\":\"Solidity\",\"output\":{\"abi\":[{\"inputs\":[{\"internalType\":\"address\",\"name\":\"timelock_\",\"type\":\"address\"},{\"internalType\":\"address\",\"name\":\"comp_\",\"type\":\"address\"},{\"internalType\":\"address\",\"name\":\"admin_\",\"type\":\"address\"},{\"internalType\":\"address\",\"name\":\"implementation_\",\"type\":\"address\"},{\"internalType\":\"uint256\",\"name\":\"votingPeriod_\",\"type\":\"uint256\"},{\"internalType\":\"uint256\",\"name\":\"votingDelay_\",\"type\":\"uint256\"},{\"internalType\":\"uint256\",\"name\":\"proposalThreshold_\",\"type\":\"uint256\"}],\"stateMutability\":\"nonpayable\",\"type\":\"constructor\"},{\"anonymous\":false,\"inputs\":[{\"indexed\":false,\"internalType\":\"address\",\"name\":\"oldAdmin\",\"type\":\"address\"},{\"indexed\":false,\"internalType\":\"address\",\"name\":\"newAdmin\",\"type\":\"address\"}],\"name\":\"NewAdmin\",\"type\":\"event\"},{\"anonymous\":false,\"inputs\":[{\"indexed\":false,\"internalType\":\"address\",\"name\":\"oldImplementation\",\"type\":\"address\"},{\"indexed\":false,\"internalType\":\"address\",\"name\":\"newImplementation\",\"type\":\"address\"}],\"name\":\"NewImplementation\",\"type\":\"event\"},{\"anonymous\":false,\"inputs\":[{\"indexed\":false,\"internalType\":\"address\",\"name\":\"oldPendingAdmin\",\"type\":\"address\"},{\"indexed\":false,\"internalType\":\"address\",\"name\":\"newPendingAdmin\",\"type\":\"address\"}],\"name\":\"NewPendingAdmin\",\"type\":\"event\"},{\"anonymous\":false,\"inputs\":[{\"indexed\":false,\"internalType\":\"uint256\",\"name\":\"id\",\"type\":\"uint256\"}],\"name\":\"ProposalCanceled\",\"type\":\"event\"},{\"anonymous\":false,\"inputs\":[{\"indexed\":false,\"internalType\":\"uint256\",\"name\":\"id\",\"type\":\"uint256\"},{\"indexed\":false,\"internalType\":\"address\",\"name\":\"proposer\",\"type\":\"address\"},{\"indexed\":false,\"internalType\":\"address[]\",\"name\":\"targets\",\"type\":\"address[]\"},{\"indexed\":false,\"internalType\":\"uint256[]\",\"name\":\"values\",\"type\":\"uint256[]\"},{\"indexed\":false,\"internalType\":\"string[]\",\"name\":\"signatures\",\"type\":\"string[]\"},{\"indexed\":false,\"internalType\":\"bytes[]\",\"name\":\"calldatas\",\"type\":\"bytes[]\"},{\"indexed\":false,\"internalType\":\"uint256\",\"name\":\"startBlock\",\"type\":\"uint256\"},{\"indexed\":false,\"internalType\":\"uint256\",\"name\":\"endBlock\",\"type\":\"uint256\"},{\"indexed\":false,\"internalType\":\"string\",\"name\":\"description\",\"type\":\"string\"}],\"name\":\"ProposalCreated\",\"type\":\"event\"},{\"anonymous\":false,\"inputs\":[{\"indexed\":false,\"internalType\":\"uint256\",\"name\":\"id\",\"type\":\"uint256\"}],\"name\":\"ProposalExecuted\",\"type\":\"event\"},{\"anonymous\":false,\"inputs\":[{\"indexed\":false,\"internalType\":\"uint256\",\"name\":\"id\",\"type\":\"uint256\"},{\"indexed\":false,\"internalType\":\"uint256\",\"name\":\"eta\",\"type\":\"uint256\"}],\"name\":\"ProposalQueued\",\"type\":\"event\"},{\"anonymous\":false,\"inputs\":[{\"indexed\":false,\"internalType\":\"uint256\",\"name\":\"oldProposalThreshold\",\"type\":\"uint256\"},{\"indexed\":false,\"internalType\":\"uint256\",\"name\":\"newProposalThreshold\",\"type\":\"uint256\"}],\"name\":\"ProposalThresholdSet\",\"type\":\"event\"},{\"anonymous\":false,\"inputs\":[{\"indexed\":true,\"internalType\":\"address\",\"name\":\"voter\",\"type\":\"address\"},{\"indexed\":false,\"internalType\":\"uint256\",\"name\":\"proposalId\",\"type\":\"uint256\"},{\"indexed\":false,\"internalType\":\"uint8\",\"name\":\"support\",\"type\":\"uint8\"},{\"indexed\":false,\"internalType\":\"uint256\",\"name\":\"votes\",\"type\":\"uint256\"},{\"indexed\":false,\"internalType\":\"string\",\"name\":\"reason\",\"type\":\"string\"}],\"name\":\"VoteCast\",\"type\":\"event\"},{\"anonymous\":false,\"inputs\":[{\"indexed\":false,\"internalType\":\"uint256\",\"name\":\"oldVotingDelay\",\"type\":\"uint256\"},{\"indexed\":false,\"internalType\":\"uint256\",\"name\":\"newVotingDelay\",\"type\":\"uint256\"}],\"name\":\"VotingDelaySet\",\"type\":\"event\"},{\"anonymous\":false,\"inputs\":[{\"indexed\":false,\"internalType\":\"uint256\",\"name\":\"oldVotingPeriod\",\"type\":\"uint256\"},{\"indexed\":false,\"internalType\":\"uint256\",\"name\":\"newVotingPeriod\",\"type\":\"uint256\"}],\"name\":\"VotingPeriodSet\",\"type\":\"event\"},{\"anonymous\":false,\"inputs\":[{\"indexed\":false,\"internalType\":\"address\",\"name\":\"account\",\"type\":\"address\"},{\"indexed\":false,\"internalType\":\"uint256\",\"name\":\"expiration\",\"type\":\"uint256\"}],\"name\":\"WhitelistAccountExpirationSet\",\"type\":\"event\"},{\"anonymous\":false,\"inputs\":[{\"indexed\":false,\"internalType\":\"address\",\"name\":\"oldGuardian\",\"type\":\"address\"},{\"indexed\":false,\"internalType\":\"address\",\"name\":\"newGuardian\",\"type\":\"address\"}],\"name\":\"WhitelistGuardianSet\",\"type\":\"event\"},{\"stateMutability\":\"payable\",\"type\":\"fallback\"},{\"inputs\":[{\"internalType\":\"address\",\"name\":\"implementation_\",\"type\":\"address\"}],\"name\":\"_setImplementation\",\"outputs\":[],\"stateMutability\":\"nonpayable\",\"type\":\"function\"},{\"inputs\":[],\"name\":\"admin\",\"outputs\":[{\"internalType\":\"address\",\"name\":\"\",\"type\":\"address\"}],\"stateMutability\":\"view\",\"type\":\"function\"},{\"inputs\":[],\"name\":\"implementation\",\"outputs\":[{\"internalType\":\"address\",\"name\":\"\",\"type\":\"address\"}],\"stateMutability\":\"view\",\"type\":\"function\"},{\"inputs\":[],\"name\":\"pendingAdmin\",\"outputs\":[{\"internalType\":\"address\",\"name\":\"\",\"type\":\"address\"}],\"stateMutability\":\"view\",\"type\":\"function\"}],\"devdoc\":{\"kind\":\"dev\",\"methods\":{\"_setImplementation(address)\":{\"params\":{\"implementation_\":\"The address of the new implementation for delegation\"}}},\"version\":1},\"userdoc\":{\"events\":{\"NewAdmin(address,address)\":{\"notice\":\"Emitted when pendingAdmin is accepted, which means admin is updated\"},\"NewImplementation(address,address)\":{\"notice\":\"Emitted when implementation is changed\"},\"NewPendingAdmin(address,address)\":{\"notice\":\"Emitted when pendingAdmin is changed\"},\"ProposalCanceled(uint256)\":{\"notice\":\"An event emitted when a proposal has been canceled\"},\"ProposalCreated(uint256,address,address[],uint256[],string[],bytes[],uint256,uint256,string)\":{\"notice\":\"An event emitted when a new proposal is created\"},\"ProposalExecuted(uint256)\":{\"notice\":\"An event emitted when a proposal has been executed in the Timelock\"},\"ProposalQueued(uint256,uint256)\":{\"notice\":\"An event emitted when a proposal has been queued in the Timelock\"},\"ProposalThresholdSet(uint256,uint256)\":{\"notice\":\"Emitted when proposal threshold is set\"},\"VoteCast(address,uint256,uint8,uint256,string)\":{\"notice\":\"An event emitted when a vote has been cast on a proposal\"},\"VotingDelaySet(uint256,uint256)\":{\"notice\":\"An event emitted when the voting delay is set\"},\"VotingPeriodSet(uint256,uint256)\":{\"notice\":\"An event emitted when the voting period is set\"},\"WhitelistAccountExpirationSet(address,uint256)\":{\"notice\":\"Emitted when whitelist account expiration is set\"},\"WhitelistGuardianSet(address,address)\":{\"notice\":\"Emitted when the whitelistGuardian is set\"}},\"kind\":\"user\",\"methods\":{\"_setImplementation(address)\":{\"notice\":\"Called by the admin to update the implementation of the delegator\"},\"admin()\":{\"notice\":\"Administrator for this contract\"},\"implementation()\":{\"notice\":\"Active brains of Governor\"},\"pendingAdmin()\":{\"notice\":\"Pending administrator for this contract\"}},\"version\":1}},\"settings\":{\"compilationTarget\":{\"contracts/Governance/GovernorBravoDelegator.sol\":\"GovernorBravoDelegator\"},\"evmVersion\":\"london\",\"libraries\":{},\"metadata\":{\"bytecodeHash\":\"ipfs\",\"useLiteralContent\":true},\"optimizer\":{\"enabled\":true,\"runs\":200},\"remappings\":[]},\"sources\":{\"contracts/Governance/GovernorBravoDelegator.sol\":{\"content\":\"// SPDX-License-Identifier: BSD-3-Clause\\npragma solidity ^0.8.10;\\n\\nimport \\\"./GovernorBravoInterfaces.sol\\\";\\n\\ncontract GovernorBravoDelegator is GovernorBravoDelegatorStorage, GovernorBravoEvents {\\n\\tconstructor(\\n\\t\\t\\taddress timelock_,\\n\\t\\t\\taddress comp_,\\n\\t\\t\\taddress admin_,\\n\\t        address implementation_,\\n\\t        uint votingPeriod_,\\n\\t        uint votingDelay_,\\n            uint proposalThreshold_) public {\\n\\n        // Admin set to msg.sender for initialization\\n        admin = msg.sender;\\n\\n        delegateTo(implementation_, abi.encodeWithSignature(\\\"initialize(address,address,uint256,uint256,uint256)\\\",\\n                                                            timelock_,\\n                                                            comp_,\\n                                                            votingPeriod_,\\n                                                            votingDelay_,\\n                                                            proposalThreshold_));\\n\\n        _setImplementation(implementation_);\\n\\n\\t\\tadmin = admin_;\\n\\t}\\n\\n\\n\\t/**\\n     * @notice Called by the admin to update the implementation of the delegator\\n     * @param implementation_ The address of the new implementation for delegation\\n     */\\n    function _setImplementation(address implementation_) public {\\n        require(msg.sender == admin, \\\"GovernorBravoDelegator::_setImplementation: admin only\\\");\\n        require(implementation_ != address(0), \\\"GovernorBravoDelegator::_setImplementation: invalid implementation address\\\");\\n\\n        address oldImplementation = implementation;\\n        implementation = implementation_;\\n\\n        emit NewImplementation(oldImplementation, implementation);\\n    }\\n\\n    /**\\n     * @notice Internal method to delegate execution to another contract\\n     * @dev It returns to the external caller whatever the implementation returns or forwards reverts\\n     * @param callee The contract to delegatecall\\n     * @param data The raw data to delegatecall\\n     */\\n    function delegateTo(address callee, bytes memory data) internal {\\n        (bool success, bytes memory returnData) = callee.delegatecall(data);\\n        assembly {\\n            if eq(success, 0) {\\n                revert(add(returnData, 0x20), returndatasize())\\n            }\\n        }\\n    }\\n\\n\\t/**\\n     * @dev Delegates execution to an implementation contract.\\n     * It returns to the external caller whatever the implementation returns\\n     * or forwards reverts.\\n     */\\n    fallback () external payable {\\n        // delegate all other functions to current implementation\\n        (bool success, ) = implementation.delegatecall(msg.data);\\n\\n        assembly {\\n              let free_mem_ptr := mload(0x40)\\n              returndatacopy(free_mem_ptr, 0, returndatasize())\\n\\n              switch success\\n              case 0 { revert(free_mem_ptr, returndatasize()) }\\n              default { return(free_mem_ptr, returndatasize()) }\\n        }\\n    }\\n}\\n\",\"keccak256\":\"0x92be17f9b2f50db62881da1ed5ddaceb44ab7d19ce7b3051ec0e5c10d470b4ef\",\"license\":\"BSD-3-Clause\"},\"contracts/Governance/GovernorBravoInterfaces.sol\":{\"content\":\"// SPDX-License-Identifier: BSD-3-Clause\\npragma solidity ^0.8.10;\\n\\n\\ncontract GovernorBravoEvents {\\n    /// @notice An event emitted when a new proposal is created\\n    event ProposalCreated(uint id, address proposer, address[] targets, uint[] values, string[] signatures, bytes[] calldatas, uint startBlock, uint endBlock, string description);\\n\\n    /// @notice An event emitted when a vote has been cast on a proposal\\n    /// @param voter The address which casted a vote\\n    /// @param proposalId The proposal id which was voted on\\n    /// @param support Support value for the vote. 0=against, 1=for, 2=abstain\\n    /// @param votes Number of votes which were cast by the voter\\n    /// @param reason The reason given for the vote by the voter\\n    event VoteCast(address indexed voter, uint proposalId, uint8 support, uint votes, string reason);\\n\\n    /// @notice An event emitted when a proposal has been canceled\\n    event ProposalCanceled(uint id);\\n\\n    /// @notice An event emitted when a proposal has been queued in the Timelock\\n    event ProposalQueued(uint id, uint eta);\\n\\n    /// @notice An event emitted when a proposal has been executed in the Timelock\\n    event ProposalExecuted(uint id);\\n\\n    /// @notice An event emitted when the voting delay is set\\n    event VotingDelaySet(uint oldVotingDelay, uint newVotingDelay);\\n\\n    /// @notice An event emitted when the voting period is set\\n    event VotingPeriodSet(uint oldVotingPeriod, uint newVotingPeriod);\\n\\n    /// @notice Emitted when implementation is changed\\n    event NewImplementation(address oldImplementation, address newImplementation);\\n\\n    /// @notice Emitted when proposal threshold is set\\n    event ProposalThresholdSet(uint oldProposalThreshold, uint newProposalThreshold);\\n\\n    /// @notice Emitted when pendingAdmin is changed\\n    event NewPendingAdmin(address oldPendingAdmin, address newPendingAdmin);\\n\\n    /// @notice Emitted when pendingAdmin is accepted, which means admin is updated\\n    event NewAdmin(address oldAdmin, address newAdmin);\\n\\n    /// @notice Emitted when whitelist account expiration is set\\n    event WhitelistAccountExpirationSet(address account, uint expiration);\\n\\n    /// @notice Emitted when the whitelistGuardian is set\\n    event WhitelistGuardianSet(address oldGuardian, address newGuardian);\\n}\\n\\ncontract GovernorBravoDelegatorStorage {\\n    /// @notice Administrator for this contract\\n    address public admin;\\n\\n    /// @notice Pending administrator for this contract\\n    address public pendingAdmin;\\n\\n    /// @notice Active brains of Governor\\n    address public implementation;\\n}\\n\\n\\n/**\\n * @title Storage for Governor Bravo Delegate\\n * @notice For future upgrades, do not change GovernorBravoDelegateStorageV1. Create a new\\n * contract which implements GovernorBravoDelegateStorageV1 and following the naming convention\\n * GovernorBravoDelegateStorageVX.\\n */\\ncontract GovernorBravoDelegateStorageV1 is GovernorBravoDelegatorStorage {\\n\\n    /// @notice The delay before voting on a proposal may take place, once proposed, in blocks\\n    uint public votingDelay;\\n\\n    /// @notice The duration of voting on a proposal, in blocks\\n    uint public votingPeriod;\\n\\n    /// @notice The number of votes required in order for a voter to become a proposer\\n    uint public proposalThreshold;\\n\\n    /// @notice Initial proposal id set at become\\n    uint public initialProposalId;\\n\\n    /// @notice The total number of proposals\\n    uint public proposalCount;\\n\\n    /// @notice The address of the Compound Protocol Timelock\\n    TimelockInterface public timelock;\\n\\n    /// @notice The address of the Compound governance token\\n    CompInterface public comp;\\n\\n    /// @notice The official record of all proposals ever proposed\\n    mapping (uint => Proposal) public proposals;\\n\\n    /// @notice The latest proposal for each proposer\\n    mapping (address => uint) public latestProposalIds;\\n\\n\\n    struct Proposal {\\n        /// @notice Unique id for looking up a proposal\\n        uint id;\\n\\n        /// @notice Creator of the proposal\\n        address proposer;\\n\\n        /// @notice The timestamp that the proposal will be available for execution, set once the vote succeeds\\n        uint eta;\\n\\n        /// @notice the ordered list of target addresses for calls to be made\\n        address[] targets;\\n\\n        /// @notice The ordered list of values (i.e. msg.value) to be passed to the calls to be made\\n        uint[] values;\\n\\n        /// @notice The ordered list of function signatures to be called\\n        string[] signatures;\\n\\n        /// @notice The ordered list of calldata to be passed to each call\\n        bytes[] calldatas;\\n\\n        /// @notice The block at which voting begins: holders must delegate their votes prior to this block\\n        uint startBlock;\\n\\n        /// @notice The block at which voting ends: votes must be cast prior to this block\\n        uint endBlock;\\n\\n        /// @notice Current number of votes in favor of this proposal\\n        uint forVotes;\\n\\n        /// @notice Current number of votes in opposition to this proposal\\n        uint againstVotes;\\n\\n        /// @notice Current number of votes for abstaining for this proposal\\n        uint abstainVotes;\\n\\n        /// @notice Flag marking whether the proposal has been canceled\\n        bool canceled;\\n\\n        /// @notice Flag marking whether the proposal has been executed\\n        bool executed;\\n\\n        /// @notice Receipts of ballots for the entire set of voters\\n        mapping (address => Receipt) receipts;\\n    }\\n\\n    /// @notice Ballot receipt record for a voter\\n    struct Receipt {\\n        /// @notice Whether or not a vote has been cast\\n        bool hasVoted;\\n\\n        /// @notice Whether or not the voter supports the proposal or abstains\\n        uint8 support;\\n\\n        /// @notice The number of votes the voter had, which were cast\\n        uint96 votes;\\n    }\\n\\n    /// @notice Possible states that a proposal may be in\\n    enum ProposalState {\\n        Pending,\\n        Active,\\n        Canceled,\\n        Defeated,\\n        Succeeded,\\n        Queued,\\n        Expired,\\n        Executed\\n    }\\n}\\n\\ncontract GovernorBravoDelegateStorageV2 is GovernorBravoDelegateStorageV1 {\\n    /// @notice Stores the expiration of account whitelist status as a timestamp\\n    mapping (address => uint) public whitelistAccountExpirations;\\n\\n    /// @notice Address which manages whitelisted proposals and whitelist accounts\\n    address public whitelistGuardian;\\n}\\n\\ninterface TimelockInterface {\\n    function delay() external view returns (uint);\\n    function GRACE_PERIOD() external view returns (uint);\\n    function acceptAdmin() external;\\n    function queuedTransactions(bytes32 hash) external view returns (bool);\\n    function queueTransaction(address target, uint value, string calldata signature, bytes calldata data, uint eta) external returns (bytes32);\\n    function cancelTransaction(address target, uint value, string calldata signature, bytes calldata data, uint eta) external;\\n    function executeTransaction(address target, uint value, string calldata signature, bytes calldata data, uint eta) external payable returns (bytes memory);\\n}\\n\\ninterface CompInterface {\\n    function getPriorVotes(address account, uint blockNumber) external view returns (uint96);\\n}\\n\\ninterface GovernorAlpha {\\n    /// @notice The total number of proposals\\n    function proposalCount() external returns (uint);\\n}\\n\",\"keccak256\":\"0xf517c16539df74103ca9ec9047c85605d00e25aff6be9d1526c406139563c651\",\"license\":\"BSD-3-Clause\"}},\"version\":1}",
  "bytecode": "0x608060405234801561001057600080fd5b506040516106dc3803806106dc83398101604081905261002f916102c5565b600080546001600160a01b031916331790556040516001600160a01b03888116602483015287166044820152606481018490526084810183905260a481018290526100ac90859060c40160408051601f198184030181529190526020810180516001600160e01b0390811663344fe42d60e21b179091526100e216565b6100b584610158565b5050600080546001600160a01b0319166001600160a01b0394909416939093179092555061037192505050565b600080836001600160a01b0316836040516100fd9190610336565b600060405180830381855af49150503d8060008114610138576040519150601f19603f3d011682016040523d82523d6000602084013e61013d565b606091505b50915091506000821415610152573d60208201fd5b50505050565b6000546001600160a01b031633146101cb5760405162461bcd60e51b815260206004820152603660248201526000805160206106bc83398151915260448201527f656d656e746174696f6e3a2061646d696e206f6e6c790000000000000000000060648201526084015b60405180910390fd5b6001600160a01b0381166102485760405162461bcd60e51b815260206004820152604a60248201526000805160206106bc83398151915260448201527f656d656e746174696f6e3a20696e76616c696420696d706c656d656e746174696064820152696f6e206164647265737360b01b608482015260a4016101c2565b600280546001600160a01b038381166001600160a01b031983168117909355604080519190921680825260208201939093527fd604de94d45953f9138079ec1b82d533cb2160c906d1076d1f7ed54befbca97a910160405180910390a15050565b80516001600160a01b03811681146102c057600080fd5b919050565b600080600080600080600060e0888a0312156102e057600080fd5b6102e9886102a9565b96506102f7602089016102a9565b9550610305604089016102a9565b9450610313606089016102a9565b93506080880151925060a0880151915060c0880151905092959891949750929550565b6000825160005b81811015610357576020818601810151858301520161033d565b81811115610366576000828501525b509190910192915050565b61033c806103806000396000f3fe60806040526004361061003f5760003560e01c806326782247146100ba5780635c60da1b146100f6578063bb913f4114610116578063f851a44014610138575b6002546040516000916001600160a01b03169061005f90839036906102c6565b600060405180830381855af49150503d806000811461009a576040519150601f19603f3d011682016040523d82523d6000602084013e61009f565b606091505b505090506040513d6000823e8180156100b6573d82f35b3d82fd5b3480156100c657600080fd5b506001546100da906001600160a01b031681565b6040516001600160a01b03909116815260200160405180910390f35b34801561010257600080fd5b506002546100da906001600160a01b031681565b34801561012257600080fd5b506101366101313660046102d6565b610158565b005b34801561014457600080fd5b506000546100da906001600160a01b031681565b6000546001600160a01b031633146101d65760405162461bcd60e51b815260206004820152603660248201527f476f7665726e6f72427261766f44656c656761746f723a3a5f736574496d706c604482015275656d656e746174696f6e3a2061646d696e206f6e6c7960501b60648201526084015b60405180910390fd5b6001600160a01b0381166102655760405162461bcd60e51b815260206004820152604a60248201527f476f7665726e6f72427261766f44656c656761746f723a3a5f736574496d706c60448201527f656d656e746174696f6e3a20696e76616c696420696d706c656d656e746174696064820152696f6e206164647265737360b01b608482015260a4016101cd565b600280546001600160a01b038381166001600160a01b031983168117909355604080519190921680825260208201939093527fd604de94d45953f9138079ec1b82d533cb2160c906d1076d1f7ed54befbca97a910160405180910390a15050565b8183823760009101908152919050565b6000602082840312156102e857600080fd5b81356001600160a01b03811681146102ff57600080fd5b939250505056fea264697066735822122015b87311c1693a980f4b9984d2d8fd9427837b0cb3bbc66ea9428f8782f039a564736f6c634300080a0033476f7665726e6f72427261766f44656c656761746f723a3a5f736574496d706c",
  "deployedBytecode": "0x60806040526004361061003f5760003560e01c806326782247146100ba5780635c60da1b146100f6578063bb913f4114610116578063f851a44014610138575b6002546040516000916001600160a01b03169061005f90839036906102c6565b600060405180830381855af49150503d806000811461009a576040519150601f19603f3d011682016040523d82523d6000602084013e61009f565b606091505b505090506040513d6000823e8180156100b6573d82f35b3d82fd5b3480156100c657600080fd5b506001546100da906001600160a01b031681565b6040516001600160a01b03909116815260200160405180910390f35b34801561010257600080fd5b506002546100da906001600160a01b031681565b34801561012257600080fd5b506101366101313660046102d6565b610158565b005b34801561014457600080fd5b506000546100da906001600160a01b031681565b6000546001600160a01b031633146101d65760405162461bcd60e51b815260206004820152603660248201527f476f7665726e6f72427261766f44656c656761746f723a3a5f736574496d706c604482015275656d656e746174696f6e3a2061646d696e206f6e6c7960501b60648201526084015b60405180910390fd5b6001600160a01b0381166102655760405162461bcd60e51b815260206004820152604a60248201527f476f7665726e6f72427261766f44656c656761746f723a3a5f736574496d706c60448201527f656d656e746174696f6e3a20696e76616c696420696d706c656d656e746174696064820152696f6e206164647265737360b01b608482015260a4016101cd565b600280546001600160a01b038381166001600160a01b031983168117909355604080519190921680825260208201939093527fd604de94d45953f9138079ec1b82d533cb2160c906d1076d1f7ed54befbca97a910160405180910390a15050565b8183823760009101908152919050565b6000602082840312156102e857600080fd5b81356001600160a01b03811681146102ff57600080fd5b939250505056fea264697066735822122015b87311c1693a980f4b9984d2d8fd9427837b0cb3bbc66ea9428f8782f039a564736f6c634300080a0033",
  "devdoc": {
    "kind": "dev",
    "methods": {
      "_setImplementation(address)": {
        "params": {
          "implementation_": "The address of the new implementation for delegation"
        }
      }
    },
    "version": 1
  },
  "userdoc": {
    "events": {
      "NewAdmin(address,address)": {
        "notice": "Emitted when pendingAdmin is accepted, which means admin is updated"
      },
      "NewImplementation(address,address)": {
        "notice": "Emitted when implementation is changed"
      },
      "NewPendingAdmin(address,address)": {
        "notice": "Emitted when pendingAdmin is changed"
      },
      "ProposalCanceled(uint256)": {
        "notice": "An event emitted when a proposal has been canceled"
      },
      "ProposalCreated(uint256,address,address[],uint256[],string[],bytes[],uint256,uint256,string)": {
        "notice": "An event emitted when a new proposal is created"
      },
      "ProposalExecuted(uint256)": {
        "notice": "An event emitted when a proposal has been executed in the Timelock"
      },
      "ProposalQueued(uint256,uint256)": {
        "notice": "An event emitted when a proposal has been queued in the Timelock"
      },
      "ProposalThresholdSet(uint256,uint256)": {
        "notice": "Emitted when proposal threshold is set"
      },
      "VoteCast(address,uint256,uint8,uint256,string)": {
        "notice": "An event emitted when a vote has been cast on a proposal"
      },
      "VotingDelaySet(uint256,uint256)": {
        "notice": "An event emitted when the voting delay is set"
      },
      "VotingPeriodSet(uint256,uint256)": {
        "notice": "An event emitted when the voting period is set"
      },
      "WhitelistAccountExpirationSet(address,uint256)": {
        "notice": "Emitted when whitelist account expiration is set"
      },
      "WhitelistGuardianSet(address,address)": {
        "notice": "Emitted when the whitelistGuardian is set"
      }
    },
    "kind": "user",
    "methods": {
      "_setImplementation(address)": {
        "notice": "Called by the admin to update the implementation of the delegator"
      },
      "admin()": {
        "notice": "Administrator for this contract"
      },
      "implementation()": {
        "notice": "Active brains of Governor"
      },
      "pendingAdmin()": {
        "notice": "Pending administrator for this contract"
      }
    },
    "version": 1
  },
  "storageLayout": {
    "storage": [
      {
        "astId": 19087,
        "contract": "contracts/Governance/GovernorBravoDelegator.sol:GovernorBravoDelegator",
        "label": "admin",
        "offset": 0,
        "slot": "0",
        "type": "t_address"
      },
      {
        "astId": 19090,
        "contract": "contracts/Governance/GovernorBravoDelegator.sol:GovernorBravoDelegator",
        "label": "pendingAdmin",
        "offset": 0,
        "slot": "1",
        "type": "t_address"
      },
      {
        "astId": 19093,
        "contract": "contracts/Governance/GovernorBravoDelegator.sol:GovernorBravoDelegator",
        "label": "implementation",
        "offset": 0,
        "slot": "2",
        "type": "t_address"
      }
    ],
    "types": {
      "t_address": {
        "encoding": "inplace",
        "label": "address",
        "numberOfBytes": "20"
      }
    }
  }
}