{
  "address": "0xbfa4a91F5ea8b8f4d00Fb378FD0fA0c970976e1c",
  "abi": [
    {
      "inputs": [
        {
          "internalType": "uint256",
          "name": "baseRatePerYear",
          "type": "uint256"
        },
        {
          "internalType": "uint256",
          "name": "multiplierPerYear",
          "type": "uint256"
        },
        {
          "internalType": "uint256",
          "name": "jumpMultiplierPerYear",
          "type": "uint256"
        },
        {
          "internalType": "uint256",
          "name": "kink_",
          "type": "uint256"
        }
      ],
      "stateMutability": "nonpayable",
      "type": "constructor"
    },
    {
      "anonymous": false,
      "inputs": [
        {
          "indexed": false,
          "internalType": "uint256",
          "name": "baseRatePerBlock",
          "type": "uint256"
        },
        {
          "indexed": false,
          "internalType": "uint256",
          "name": "multiplierPerBlock",
          "type": "uint256"
        },
        {
          "indexed": false,
          "internalType": "uint256",
          "name": "jumpMultiplierPerBlock",
          "type": "uint256"
        },
        {
          "indexed": false,
          "internalType": "uint256",
          "name": "kink",
          "type": "uint256"
        }
      ],
      "name": "NewInterestParams",
      "type": "event"
    },
    {
      "inputs": [],
      "name": "baseRatePerBlock",
      "outputs": [
        {
          "internalType": "uint256",
          "name": "",
          "type": "uint256"
        }
      ],
      "stateMutability": "view",
      "type": "function"
    },
    {
      "inputs": [],
      "name": "blocksPerYear",
      "outputs": [
        {
          "internalType": "uint256",
          "name": "",
          "type": "uint256"
        }
      ],
      "stateMutability": "view",
      "type": "function"
    },
    {
      "inputs": [
        {
          "internalType": "uint256",
          "name": "cash",
          "type": "uint256"
        },
        {
          "internalType": "uint256",
          "name": "borrows",
          "type": "uint256"
        },
        {
          "internalType": "uint256",
          "name": "reserves",
          "type": "uint256"
        }
      ],
      "name": "getBorrowRate",
      "outputs": [
        {
          "internalType": "uint256",
          "name": "",
          "type": "uint256"
        }
      ],
      "stateMutability": "view",
      "type": "function"
    },
    {
      "inputs": [
        {
          "internalType": "uint256",
          "name": "cash",
          "type": "uint256"
        },
        {
          "internalType": "uint256",
          "name": "borrows",
          "type": "uint256"
        },
        {
          "internalType": "uint256",
          "name": "reserves",
          "type": "uint256"
        },
        {
          "internalType": "uint256",
          "name": "reserveFactorMantissa",
          "type": "uint256"
        }
      ],
      "name": "getSupplyRate",
      "outputs": [
        {
          "internalType": "uint256",
          "name": "",
          "type": "uint256"
        }
      ],
      "stateMutability": "view",
      "type": "function"
    },
    {
      "inputs": [],
      "name": "isInterestRateModel",
      "outputs": [
        {
          "internalType": "bool",
          "name": "",
          "type": "bool"
        }
      ],
      "stateMutability": "view",
      "type": "function"
    },
    {
      "inputs": [],
      "name": "jumpMultiplierPerBlock",
      "outputs": [
        {
          "internalType": "uint256",
          "name": "",
          "type": "uint256"
        }
      ],
      "stateMutability": "view",
      "type": "function"
    },
    {
      "inputs": [],
      "name": "kink",
      "outputs": [
        {
          "internalType": "uint256",
          "name": "",
          "type": "uint256"
        }
      ],
      "stateMutability": "view",
      "type": "function"
    },
    {
      "inputs": [],
      "name": "multiplierPerBlock",
      "outputs": [
        {
          "internalType": "uint256",
          "name": "",
          "type": "uint256"
        }
      ],
      "stateMutability": "view",
      "type": "function"
    },
    {
      "inputs": [
        {
          "internalType": "uint256",
          "name": "cash",
          "type": "uint256"
        },
        {
          "internalType": "uint256",
          "name": "borrows",
          "type": "uint256"
        },
        {
          "internalType": "uint256",
          "name": "reserves",
          "type": "uint256"
        }
      ],
      "name": "utilizationRate",
      "outputs": [
        {
          "internalType": "uint256",
          "name": "",
          "type": "uint256"
        }
      ],
      "stateMutability": "pure",
      "type": "function"
    }
  ],
  "transactionHash": "0x38a6166fc1d94162d2a363c1c72a57b11a2f26757406b6d9db37bb15cfbf677e",
  "receipt": {
    "to": null,
    "from": "0xc62661BAe6E8346725305318476521E87977E371",
    "contractAddress": "0xbfa4a91F5ea8b8f4d00Fb378FD0fA0c970976e1c",
    "transactionIndex": 0,
    "gasUsed": "340686",
    "logsBloom": "0x00000000000000008000000000000000000000200000000000000000000000000000000001000000000000000000000000000000000000000000000000000000000000000000000000000000000000000000000000000000000000000000000000000000000000000000000000000000000000000000000000000000000000000000000000000000000000000000000000000000000000000000000000000000000000000004000000000000000000000000080000000000000000000000000000000000000000000000000000000000040000000000000000000000000000000000000000000000000000000000000000000000000000000000000000000000",
    "blockHash": "0x7353ea89065edb090c25fd40d591731a90bc6663e0e3b5f3e6644c6220b619aa",
    "transactionHash": "0x38a6166fc1d94162d2a363c1c72a57b11a2f26757406b6d9db37bb15cfbf677e",
    "logs": [
      {
        "transactionIndex": 0,
        "blockNumber": 12747112,
        "transactionHash": "0x38a6166fc1d94162d2a363c1c72a57b11a2f26757406b6d9db37bb15cfbf677e",
        "address": "0xbfa4a91F5ea8b8f4d00Fb378FD0fA0c970976e1c",
        "topics": [
          "0x6960ab234c7ef4b0c9197100f5393cfcde7c453ac910a27bd2000aa1dd4c068d"
        ],
        "data": "0x0000000000000000000000000000000000000000000000000000000000000000000000000000000000000000000000000000000000000000000000012e687bfd0000000000000000000000000000000000000000000000000000001fe50513b900000000000000000000000000000000000000000000000009b6e64a8ec60000",
        "logIndex": 0,
        "blockHash": "0x7353ea89065edb090c25fd40d591731a90bc6663e0e3b5f3e6644c6220b619aa"
      }
    ],
    "blockNumber": 12747112,
    "cumulativeGasUsed": "340686",
    "status": 1,
    "byzantium": true
  },
  "args": [
    0,
    "40000000000000000",
    "1080000000000000000",
    "700000000000000000"
  ],
  "numDeployments": 1,
  "solcInputHash": "eecd7762ef49b96a47f0ae6feefff385",
  "metadata": "{\"compiler\":{\"version\":\"0.8.10+commit.fc410830\"},\"language\":\"Solidity\",\"output\":{\"abi\":[{\"inputs\":[{\"internalType\":\"uint256\",\"name\":\"baseRatePerYear\",\"type\":\"uint256\"},{\"internalType\":\"uint256\",\"name\":\"multiplierPerYear\",\"type\":\"uint256\"},{\"internalType\":\"uint256\",\"name\":\"jumpMultiplierPerYear\",\"type\":\"uint256\"},{\"internalType\":\"uint256\",\"name\":\"kink_\",\"type\":\"uint256\"}],\"stateMutability\":\"nonpayable\",\"type\":\"constructor\"},{\"anonymous\":false,\"inputs\":[{\"indexed\":false,\"internalType\":\"uint256\",\"name\":\"baseRatePerBlock\",\"type\":\"uint256\"},{\"indexed\":false,\"internalType\":\"uint256\",\"name\":\"multiplierPerBlock\",\"type\":\"uint256\"},{\"indexed\":false,\"internalType\":\"uint256\",\"name\":\"jumpMultiplierPerBlock\",\"type\":\"uint256\"},{\"indexed\":false,\"internalType\":\"uint256\",\"name\":\"kink\",\"type\":\"uint256\"}],\"name\":\"NewInterestParams\",\"type\":\"event\"},{\"inputs\":[],\"name\":\"baseRatePerBlock\",\"outputs\":[{\"internalType\":\"uint256\",\"name\":\"\",\"type\":\"uint256\"}],\"stateMutability\":\"view\",\"type\":\"function\"},{\"inputs\":[],\"name\":\"blocksPerYear\",\"outputs\":[{\"internalType\":\"uint256\",\"name\":\"\",\"type\":\"uint256\"}],\"stateMutability\":\"view\",\"type\":\"function\"},{\"inputs\":[{\"internalType\":\"uint256\",\"name\":\"cash\",\"type\":\"uint256\"},{\"internalType\":\"uint256\",\"name\":\"borrows\",\"type\":\"uint256\"},{\"internalType\":\"uint256\",\"name\":\"reserves\",\"type\":\"uint256\"}],\"name\":\"getBorrowRate\",\"outputs\":[{\"internalType\":\"uint256\",\"name\":\"\",\"type\":\"uint256\"}],\"stateMutability\":\"view\",\"type\":\"function\"},{\"inputs\":[{\"internalType\":\"uint256\",\"name\":\"cash\",\"type\":\"uint256\"},{\"internalType\":\"uint256\",\"name\":\"borrows\",\"type\":\"uint256\"},{\"internalType\":\"uint256\",\"name\":\"reserves\",\"type\":\"uint256\"},{\"internalType\":\"uint256\",\"name\":\"reserveFactorMantissa\",\"type\":\"uint256\"}],\"name\":\"getSupplyRate\",\"outputs\":[{\"internalType\":\"uint256\",\"name\":\"\",\"type\":\"uint256\"}],\"stateMutability\":\"view\",\"type\":\"function\"},{\"inputs\":[],\"name\":\"isInterestRateModel\",\"outputs\":[{\"internalType\":\"bool\",\"name\":\"\",\"type\":\"bool\"}],\"stateMutability\":\"view\",\"type\":\"function\"},{\"inputs\":[],\"name\":\"jumpMultiplierPerBlock\",\"outputs\":[{\"internalType\":\"uint256\",\"name\":\"\",\"type\":\"uint256\"}],\"stateMutability\":\"view\",\"type\":\"function\"},{\"inputs\":[],\"name\":\"kink\",\"outputs\":[{\"internalType\":\"uint256\",\"name\":\"\",\"type\":\"uint256\"}],\"stateMutability\":\"view\",\"type\":\"function\"},{\"inputs\":[],\"name\":\"multiplierPerBlock\",\"outputs\":[{\"internalType\":\"uint256\",\"name\":\"\",\"type\":\"uint256\"}],\"stateMutability\":\"view\",\"type\":\"function\"},{\"inputs\":[{\"internalType\":\"uint256\",\"name\":\"cash\",\"type\":\"uint256\"},{\"internalType\":\"uint256\",\"name\":\"borrows\",\"type\":\"uint256\"},{\"internalType\":\"uint256\",\"name\":\"reserves\",\"type\":\"uint256\"}],\"name\":\"utilizationRate\",\"outputs\":[{\"internalType\":\"uint256\",\"name\":\"\",\"type\":\"uint256\"}],\"stateMutability\":\"pure\",\"type\":\"function\"}],\"devdoc\":{\"author\":\"Compound\",\"kind\":\"dev\",\"methods\":{\"constructor\":{\"params\":{\"baseRatePerYear\":\"The approximate target base APR, as a mantissa (scaled by BASE)\",\"jumpMultiplierPerYear\":\"The multiplierPerBlock after hitting a specified utilization point\",\"kink_\":\"The utilization point at which the jump multiplier is applied\",\"multiplierPerYear\":\"The rate of increase in interest rate wrt utilization (scaled by BASE)\"}},\"getBorrowRate(uint256,uint256,uint256)\":{\"params\":{\"borrows\":\"The amount of borrows in the market\",\"cash\":\"The amount of cash in the market\",\"reserves\":\"The amount of reserves in the market\"},\"returns\":{\"_0\":\"The borrow rate percentage per block as a mantissa (scaled by BASE)\"}},\"getSupplyRate(uint256,uint256,uint256,uint256)\":{\"params\":{\"borrows\":\"The amount of borrows in the market\",\"cash\":\"The amount of cash in the market\",\"reserveFactorMantissa\":\"The current reserve factor for the market\",\"reserves\":\"The amount of reserves in the market\"},\"returns\":{\"_0\":\"The supply rate percentage per block as a mantissa (scaled by BASE)\"}},\"utilizationRate(uint256,uint256,uint256)\":{\"params\":{\"borrows\":\"The amount of borrows in the market\",\"cash\":\"The amount of cash in the market\",\"reserves\":\"The amount of reserves in the market (currently unused)\"},\"returns\":{\"_0\":\"The utilization rate as a mantissa between [0, BASE]\"}}},\"title\":\"Compound's JumpRateModel Contract\",\"version\":1},\"userdoc\":{\"kind\":\"user\",\"methods\":{\"baseRatePerBlock()\":{\"notice\":\"The base interest rate which is the y-intercept when utilization rate is 0\"},\"blocksPerYear()\":{\"notice\":\"The approximate number of blocks per year that is assumed by the interest rate model\"},\"constructor\":{\"notice\":\"Construct an interest rate model\"},\"getBorrowRate(uint256,uint256,uint256)\":{\"notice\":\"Calculates the current borrow rate per block, with the error code expected by the market\"},\"getSupplyRate(uint256,uint256,uint256,uint256)\":{\"notice\":\"Calculates the current supply rate per block\"},\"isInterestRateModel()\":{\"notice\":\"Indicator that this is an InterestRateModel contract (for inspection)\"},\"jumpMultiplierPerBlock()\":{\"notice\":\"The multiplierPerBlock after hitting a specified utilization point\"},\"kink()\":{\"notice\":\"The utilization point at which the jump multiplier is applied\"},\"multiplierPerBlock()\":{\"notice\":\"The multiplier of utilization rate that gives the slope of the interest rate\"},\"utilizationRate(uint256,uint256,uint256)\":{\"notice\":\"Calculates the utilization rate of the market: `borrows / (cash + borrows - reserves)`\"}},\"version\":1}},\"settings\":{\"compilationTarget\":{\"contracts/JumpRateModel.sol\":\"JumpRateModel\"},\"evmVersion\":\"london\",\"libraries\":{},\"metadata\":{\"bytecodeHash\":\"ipfs\",\"useLiteralContent\":true},\"optimizer\":{\"enabled\":true,\"runs\":200},\"remappings\":[]},\"sources\":{\"contracts/InterestRateModel.sol\":{\"content\":\"// SPDX-License-Identifier: BSD-3-Clause\\npragma solidity ^0.8.10;\\n\\n/**\\n  * @title Compound's InterestRateModel Interface\\n  * @author Compound\\n  */\\nabstract contract InterestRateModel {\\n    /// @notice Indicator that this is an InterestRateModel contract (for inspection)\\n    bool public constant isInterestRateModel = true;\\n\\n    /**\\n      * @notice Calculates the current borrow interest rate per block\\n      * @param cash The total amount of cash the market has\\n      * @param borrows The total amount of borrows the market has outstanding\\n      * @param reserves The total amount of reserves the market has\\n      * @return The borrow rate per block (as a percentage, and scaled by 1e18)\\n      */\\n    function getBorrowRate(uint cash, uint borrows, uint reserves) virtual external view returns (uint);\\n\\n    /**\\n      * @notice Calculates the current supply interest rate per block\\n      * @param cash The total amount of cash the market has\\n      * @param borrows The total amount of borrows the market has outstanding\\n      * @param reserves The total amount of reserves the market has\\n      * @param reserveFactorMantissa The current reserve factor the market has\\n      * @return The supply rate per block (as a percentage, and scaled by 1e18)\\n      */\\n    function getSupplyRate(uint cash, uint borrows, uint reserves, uint reserveFactorMantissa) virtual external view returns (uint);\\n}\\n\",\"keccak256\":\"0x470821c8ff2120381ead6f54dba5c7b4fc0209682062bde51ea20291176aa0be\",\"license\":\"BSD-3-Clause\"},\"contracts/JumpRateModel.sol\":{\"content\":\"// SPDX-License-Identifier: BSD-3-Clause\\npragma solidity ^0.8.10;\\n\\nimport \\\"./InterestRateModel.sol\\\";\\n\\n/**\\n  * @title Compound's JumpRateModel Contract\\n  * @author Compound\\n  */\\ncontract JumpRateModel is InterestRateModel {\\n    event NewInterestParams(uint baseRatePerBlock, uint multiplierPerBlock, uint jumpMultiplierPerBlock, uint kink);\\n\\n    uint256 private constant BASE = 1e18;\\n\\n    /**\\n     * @notice The approximate number of blocks per year that is assumed by the interest rate model\\n     */\\n    uint public constant blocksPerYear = 7884000;\\n\\n    /**\\n     * @notice The multiplier of utilization rate that gives the slope of the interest rate\\n     */\\n    uint public multiplierPerBlock;\\n\\n    /**\\n     * @notice The base interest rate which is the y-intercept when utilization rate is 0\\n     */\\n    uint public baseRatePerBlock;\\n\\n    /**\\n     * @notice The multiplierPerBlock after hitting a specified utilization point\\n     */\\n    uint public jumpMultiplierPerBlock;\\n\\n    /**\\n     * @notice The utilization point at which the jump multiplier is applied\\n     */\\n    uint public kink;\\n\\n    /**\\n     * @notice Construct an interest rate model\\n     * @param baseRatePerYear The approximate target base APR, as a mantissa (scaled by BASE)\\n     * @param multiplierPerYear The rate of increase in interest rate wrt utilization (scaled by BASE)\\n     * @param jumpMultiplierPerYear The multiplierPerBlock after hitting a specified utilization point\\n     * @param kink_ The utilization point at which the jump multiplier is applied\\n     */\\n    constructor(uint baseRatePerYear, uint multiplierPerYear, uint jumpMultiplierPerYear, uint kink_) public {\\n        baseRatePerBlock = baseRatePerYear / blocksPerYear;\\n        multiplierPerBlock = multiplierPerYear / blocksPerYear;\\n        jumpMultiplierPerBlock = jumpMultiplierPerYear / blocksPerYear;\\n        kink = kink_;\\n\\n        emit NewInterestParams(baseRatePerBlock, multiplierPerBlock, jumpMultiplierPerBlock, kink);\\n    }\\n\\n    /**\\n     * @notice Calculates the utilization rate of the market: `borrows / (cash + borrows - reserves)`\\n     * @param cash The amount of cash in the market\\n     * @param borrows The amount of borrows in the market\\n     * @param reserves The amount of reserves in the market (currently unused)\\n     * @return The utilization rate as a mantissa between [0, BASE]\\n     */\\n    function utilizationRate(uint cash, uint borrows, uint reserves) public pure returns (uint) {\\n        // Utilization rate is 0 when there are no borrows\\n        if (borrows == 0) {\\n            return 0;\\n        }\\n\\n        return borrows * BASE / (cash + borrows - reserves);\\n    }\\n\\n    /**\\n     * @notice Calculates the current borrow rate per block, with the error code expected by the market\\n     * @param cash The amount of cash in the market\\n     * @param borrows The amount of borrows in the market\\n     * @param reserves The amount of reserves in the market\\n     * @return The borrow rate percentage per block as a mantissa (scaled by BASE)\\n     */\\n    function getBorrowRate(uint cash, uint borrows, uint reserves) override public view returns (uint) {\\n        uint util = utilizationRate(cash, borrows, reserves);\\n\\n        if (util <= kink) {\\n            return (util * multiplierPerBlock / BASE) + baseRatePerBlock;\\n        } else {\\n            uint normalRate = (kink * multiplierPerBlock / BASE) + baseRatePerBlock;\\n            uint excessUtil = util - kink;\\n            return (excessUtil * jumpMultiplierPerBlock/ BASE) + normalRate;\\n        }\\n    }\\n\\n    /**\\n     * @notice Calculates the current supply rate per block\\n     * @param cash The amount of cash in the market\\n     * @param borrows The amount of borrows in the market\\n     * @param reserves The amount of reserves in the market\\n     * @param reserveFactorMantissa The current reserve factor for the market\\n     * @return The supply rate percentage per block as a mantissa (scaled by BASE)\\n     */\\n    function getSupplyRate(uint cash, uint borrows, uint reserves, uint reserveFactorMantissa) override public view returns (uint) {\\n        uint oneMinusReserveFactor = BASE - reserveFactorMantissa;\\n        uint borrowRate = getBorrowRate(cash, borrows, reserves);\\n        uint rateToPool = borrowRate * oneMinusReserveFactor / BASE;\\n        return utilizationRate(cash, borrows, reserves) * rateToPool / BASE;\\n    }\\n}\\n\",\"keccak256\":\"0x096000e73ca1c8b36d0dc7722d42a880d87a06e5db07760954445f15b03c3fc1\",\"license\":\"BSD-3-Clause\"}},\"version\":1}",
  "bytecode": "0x608060405234801561001057600080fd5b506040516104fb3803806104fb83398101604081905261002f916100be565b61003c62784ce0856100f4565b60015561004c62784ce0846100f4565b60005561005c62784ce0836100f4565b60028190556003829055600154600054604080519283526020830191909152810191909152606081018290527f6960ab234c7ef4b0c9197100f5393cfcde7c453ac910a27bd2000aa1dd4c068d9060800160405180910390a150505050610116565b600080600080608085870312156100d457600080fd5b505082516020840151604085015160609095015191969095509092509050565b60008261011157634e487b7160e01b600052601260045260246000fd5b500490565b6103d6806101256000396000f3fe608060405234801561001057600080fd5b50600436106100935760003560e01c8063a385fb9611610066578063a385fb96146100f2578063b8168816146100fc578063b9f9850a1461010f578063f14039de14610118578063fd2da3391461012157600080fd5b806315f24053146100985780632191f92a146100be5780636e71e2d8146100d65780638726bb89146100e9575b600080fd5b6100ab6100a63660046102bc565b61012a565b6040519081526020015b60405180910390f35b6100c6600181565b60405190151581526020016100b5565b6100ab6100e43660046102bc565b6101f8565b6100ab60005481565b6100ab62784ce081565b6100ab61010a3660046102e8565b610240565b6100ab60025481565b6100ab60015481565b6100ab60035481565b6000806101388585856101f8565b9050600354811161017957600154670de0b6b3a76400006000548361015d9190610330565b610167919061034f565b6101719190610371565b9150506101f1565b6000600154670de0b6b3a76400006000546003546101979190610330565b6101a1919061034f565b6101ab9190610371565b90506000600354836101bd9190610389565b905081670de0b6b3a7640000600254836101d79190610330565b6101e1919061034f565b6101eb9190610371565b93505050505b9392505050565b600082610207575060006101f1565b816102128486610371565b61021c9190610389565b61022e670de0b6b3a764000085610330565b610238919061034f565b949350505050565b60008061025583670de0b6b3a7640000610389565b9050600061026487878761012a565b90506000670de0b6b3a764000061027b8484610330565b610285919061034f565b9050670de0b6b3a76400008161029c8a8a8a6101f8565b6102a69190610330565b6102b0919061034f565b98975050505050505050565b6000806000606084860312156102d157600080fd5b505081359360208301359350604090920135919050565b600080600080608085870312156102fe57600080fd5b5050823594602084013594506040840135936060013592509050565b634e487b7160e01b600052601160045260246000fd5b600081600019048311821515161561034a5761034a61031a565b500290565b60008261036c57634e487b7160e01b600052601260045260246000fd5b500490565b600082198211156103845761038461031a565b500190565b60008282101561039b5761039b61031a565b50039056fea2646970667358221220f92d4cce4ba677a12ae02e5429d0a928701607f6da05b02668ee5c48915309a764736f6c634300080a0033",
  "deployedBytecode": "0x608060405234801561001057600080fd5b50600436106100935760003560e01c8063a385fb9611610066578063a385fb96146100f2578063b8168816146100fc578063b9f9850a1461010f578063f14039de14610118578063fd2da3391461012157600080fd5b806315f24053146100985780632191f92a146100be5780636e71e2d8146100d65780638726bb89146100e9575b600080fd5b6100ab6100a63660046102bc565b61012a565b6040519081526020015b60405180910390f35b6100c6600181565b60405190151581526020016100b5565b6100ab6100e43660046102bc565b6101f8565b6100ab60005481565b6100ab62784ce081565b6100ab61010a3660046102e8565b610240565b6100ab60025481565b6100ab60015481565b6100ab60035481565b6000806101388585856101f8565b9050600354811161017957600154670de0b6b3a76400006000548361015d9190610330565b610167919061034f565b6101719190610371565b9150506101f1565b6000600154670de0b6b3a76400006000546003546101979190610330565b6101a1919061034f565b6101ab9190610371565b90506000600354836101bd9190610389565b905081670de0b6b3a7640000600254836101d79190610330565b6101e1919061034f565b6101eb9190610371565b93505050505b9392505050565b600082610207575060006101f1565b816102128486610371565b61021c9190610389565b61022e670de0b6b3a764000085610330565b610238919061034f565b949350505050565b60008061025583670de0b6b3a7640000610389565b9050600061026487878761012a565b90506000670de0b6b3a764000061027b8484610330565b610285919061034f565b9050670de0b6b3a76400008161029c8a8a8a6101f8565b6102a69190610330565b6102b0919061034f565b98975050505050505050565b6000806000606084860312156102d157600080fd5b505081359360208301359350604090920135919050565b600080600080608085870312156102fe57600080fd5b5050823594602084013594506040840135936060013592509050565b634e487b7160e01b600052601160045260246000fd5b600081600019048311821515161561034a5761034a61031a565b500290565b60008261036c57634e487b7160e01b600052601260045260246000fd5b500490565b600082198211156103845761038461031a565b500190565b60008282101561039b5761039b61031a565b50039056fea2646970667358221220f92d4cce4ba677a12ae02e5429d0a928701607f6da05b02668ee5c48915309a764736f6c634300080a0033",
  "devdoc": {
    "author": "Compound",
    "kind": "dev",
    "methods": {
      "constructor": {
        "params": {
          "baseRatePerYear": "The approximate target base APR, as a mantissa (scaled by BASE)",
          "jumpMultiplierPerYear": "The multiplierPerBlock after hitting a specified utilization point",
          "kink_": "The utilization point at which the jump multiplier is applied",
          "multiplierPerYear": "The rate of increase in interest rate wrt utilization (scaled by BASE)"
        }
      },
      "getBorrowRate(uint256,uint256,uint256)": {
        "params": {
          "borrows": "The amount of borrows in the market",
          "cash": "The amount of cash in the market",
          "reserves": "The amount of reserves in the market"
        },
        "returns": {
          "_0": "The borrow rate percentage per block as a mantissa (scaled by BASE)"
        }
      },
      "getSupplyRate(uint256,uint256,uint256,uint256)": {
        "params": {
          "borrows": "The amount of borrows in the market",
          "cash": "The amount of cash in the market",
          "reserveFactorMantissa": "The current reserve factor for the market",
          "reserves": "The amount of reserves in the market"
        },
        "returns": {
          "_0": "The supply rate percentage per block as a mantissa (scaled by BASE)"
        }
      },
      "utilizationRate(uint256,uint256,uint256)": {
        "params": {
          "borrows": "The amount of borrows in the market",
          "cash": "The amount of cash in the market",
          "reserves": "The amount of reserves in the market (currently unused)"
        },
        "returns": {
          "_0": "The utilization rate as a mantissa between [0, BASE]"
        }
      }
    },
    "title": "Compound's JumpRateModel Contract",
    "version": 1
  },
  "userdoc": {
    "kind": "user",
    "methods": {
      "baseRatePerBlock()": {
        "notice": "The base interest rate which is the y-intercept when utilization rate is 0"
      },
      "blocksPerYear()": {
        "notice": "The approximate number of blocks per year that is assumed by the interest rate model"
      },
      "constructor": {
        "notice": "Construct an interest rate model"
      },
      "getBorrowRate(uint256,uint256,uint256)": {
        "notice": "Calculates the current borrow rate per block, with the error code expected by the market"
      },
      "getSupplyRate(uint256,uint256,uint256,uint256)": {
        "notice": "Calculates the current supply rate per block"
      },
      "isInterestRateModel()": {
        "notice": "Indicator that this is an InterestRateModel contract (for inspection)"
      },
      "jumpMultiplierPerBlock()": {
        "notice": "The multiplierPerBlock after hitting a specified utilization point"
      },
      "kink()": {
        "notice": "The utilization point at which the jump multiplier is applied"
      },
      "multiplierPerBlock()": {
        "notice": "The multiplier of utilization rate that gives the slope of the interest rate"
      },
      "utilizationRate(uint256,uint256,uint256)": {
        "notice": "Calculates the utilization rate of the market: `borrows / (cash + borrows - reserves)`"
      }
    },
    "version": 1
  },
  "storageLayout": {
    "storage": [
      {
        "astId": 19356,
        "contract": "contracts/JumpRateModel.sol:JumpRateModel",
        "label": "multiplierPerBlock",
        "offset": 0,
        "slot": "0",
        "type": "t_uint256"
      },
      {
        "astId": 19359,
        "contract": "contracts/JumpRateModel.sol:JumpRateModel",
        "label": "baseRatePerBlock",
        "offset": 0,
        "slot": "1",
        "type": "t_uint256"
      },
      {
        "astId": 19362,
        "contract": "contracts/JumpRateModel.sol:JumpRateModel",
        "label": "jumpMultiplierPerBlock",
        "offset": 0,
        "slot": "2",
        "type": "t_uint256"
      },
      {
        "astId": 19365,
        "contract": "contracts/JumpRateModel.sol:JumpRateModel",
        "label": "kink",
        "offset": 0,
        "slot": "3",
        "type": "t_uint256"
      }
    ],
    "types": {
      "t_uint256": {
        "encoding": "inplace",
        "label": "uint256",
        "numberOfBytes": "32"
      }
    }
  }
}